### ISSUE TITLE
KVM guest failed to ipv4 address with devel build

### ISSUE THREAD

**Issue by sathnaga** [open-power-host-os/libvirt#5]
<cde:info> Mirrored with LTC bug https://bugzilla.linux.ibm.com/show_bug.cgi?id=160567 </cde:info>

After Latest devel build update on host, guest fails to get ipv4 address.

```
Host:
Kernel: 4.14.0-1.rc4.dev.gitb27fc5c.el7.centos.ppc64le
libvirt: libvirt-3.6.0-3.dev.gitdd9401b.el7.centos.ppc64le
qemu: qemu-2.10.0-3.dev.gitbf0fd83.el7.centos.ppc64le

Guest:
 4.14.0-1.rc4.dev.gitb27fc5c.el7.centos.ppc64le

# ifconfig eth0
eth0: flags=4163<UP,BROADCAST,RUNNING,MULTICAST>  mtu 1500
        ether 52:54:00:b3:b4:b5  txqueuelen 1000  (Ethernet)
        RX packets 165  bytes 8910 (8.7 KiB)
        RX errors 0  dropped 7  overruns 0  frame 0
        TX packets 52  bytes 8376 (8.1 KiB)
        TX errors 0  dropped 0 overruns 0  carrier 0  collisions 0

```
Same guest image able to get ipv4 address on latest release branch

```
Host: 4.13.0-4.rel.git49564cb.el7.centos.ppc64le
qemu: qemu-2.10.0-2.rel.gitc334a4e.el7.centos.ppc64le
libvirt: libvirt-3.6.0-3.rel.gitdd9401b.el7.centos.ppc64le

Guest: 
 4.14.0-1.rc4.dev.gitb27fc5c.el7.centos.ppc64le

# ifconfig eth0
eth0: flags=4163<UP,BROADCAST,RUNNING,MULTICAST>  mtu 1500
        inet 192.168.122.249  netmask 255.255.255.0  broadcast 192.168.122.255
        inet6 fe80::5054:ff:fea3:a7a5  prefixlen 64  scopeid 0x20<link>
        ether 52:54:00:a3:a7:a5  txqueuelen 1000  (Ethernet)
        RX packets 30771  bytes 1628961 (1.5 MiB)
        RX errors 0  dropped 3  overruns 0  frame 0
        TX packets 1389  bytes 98018 (95.7 KiB)
        TX errors 0  dropped 0 overruns 0  carrier 0  collisions 0
```

**Comment by sathnaga** [comment]
tcpdump during a dhclient inside guest

Working env:
```
# tcpdump -i virbr0
tcpdump: verbose output suppressed, use -v or -vv for full protocol decode
listening on virbr0, link-type EN10MB (Ethernet), capture size 262144 bytes
11:37:33.036197 IP 0.0.0.0.bootpc > 255.255.255.255.bootps: BOOTP/DHCP, Request from 52:54:00:a3:a7:a5 (oui Unknown), length 300
11:37:33.036558 IP zzfp365-lp1.aus.stglabs.ibm.com.bootps > 192.168.122.249.bootpc: BOOTP/DHCP, Reply, length 300
11:37:33.036748 IP 192.168.122.249 > zzfp365-lp1.aus.stglabs.ibm.com: ICMP host 192.168.122.249 unreachable - admin prohibited, length 336
11:37:33.036868 IP 0.0.0.0.bootpc > 255.255.255.255.bootps: BOOTP/DHCP, Request from 52:54:00:a3:a7:a5 (oui Unknown), length 300
11:37:33.036978 IP zzfp365-lp1.aus.stglabs.ibm.com.bootps > 192.168.122.249.bootpc: BOOTP/DHCP, Reply, length 300
11:37:33.037072 IP 192.168.122.249 > zzfp365-lp1.aus.stglabs.ibm.com: ICMP host 192.168.122.249 unreachable - admin prohibited, length 336
11:37:33.074568 ARP, Request who-has 192.168.122.249 (Broadcast) tell 0.0.0.0, length 28
11:37:34.074581 ARP, Request who-has 192.168.122.249 (Broadcast) tell 0.0.0.0, length 28
11:37:38.049867 ARP, Request who-has 192.168.122.249 tell zzfp365-lp1.aus.stglabs.ibm.com, length 28
11:37:38.049975 ARP, Reply 192.168.122.249 is-at 52:54:00:a3:a7:a5 (oui Unknown), length 28
11:37:38.075815 ARP, Request who-has zzfp365-lp1.aus.stglabs.ibm.com tell 192.168.122.249, length 28
11:37:38.075823 ARP, Reply zzfp365-lp1.aus.stglabs.ibm.com is-at 52:54:00:af:5e:70 (oui Unknown), length 28
11:37:44.475926 IP 192.168.122.249.52958 > senary.server.edv-froehlich.de.ntp: NTPv4, Client, length 48
11:37:44.573226 IP senary.server.edv-froehlich.de.ntp > 192.168.122.249.52958: NTPv4, Server, length 48
11:37:45.565129 IP 192.168.122.249.54700 > time-a.nist.gov.ntp: NTPv4, Client, length 48
11:37:45.646458 IP time-a.nist.gov.ntp > 192.168.122.249.54700: NTPv3, Server, length 48
11:38:41.729723 IP 192.168.122.249.55220 > ntp.backplanedns.org.ntp: NTPv4, Client, length 48
```


Not working env:
```
# tcpdump -i virbr0
tcpdump: verbose output suppressed, use -v or -vv for full protocol decode
listening on virbr0, link-type EN10MB (Ethernet), capture size 262144 bytes
11:58:06.325554 IP 0.0.0.0.bootpc > 255.255.255.255.bootps: BOOTP/DHCP, Request from 52:54:00:b3:b4:b5 (oui Unknown), length 300
12:01:12.590185 IP 0.0.0.0.bootpc > 255.255.255.255.bootps: BOOTP/DHCP, Request from 52:54:00:b3:b4:b5 (oui Unknown), length 300
12:01:17.870107 IP 0.0.0.0.bootpc > 255.255.255.255.bootps: BOOTP/DHCP, Request from 52:54:00:b3:b4:b5 (oui Unknown), length 300
12:01:25.966388 IP 0.0.0.0.bootpc > 255.255.255.255.bootps: BOOTP/DHCP, Request from 52:54:00:b3:b4:b5 (oui Unknown), length 300
12:01:39.967173 IP 0.0.0.0.bootpc > 255.255.255.255.bootps: BOOTP/DHCP, Request from 52:54:00:b3:b4:b5 (oui Unknown), length 300
12:01:53.482177 IP 0.0.0.0.bootpc > 255.255.255.255.bootps: BOOTP/DHCP, Request from 52:54:00:b3:b4:b5 (oui Unknown), length 300
12:02:06.149233 IP 0.0.0.0.bootpc > 255.255.255.255.bootps: BOOTP/DHCP, Request from 52:54:00:b3:b4:b5 (oui Unknown), length 300
12:03:15.957084 IP6 :: > ff02::16: HBH ICMP6, multicast listener report v2, 1 group record(s), length 28
12:03:16.018366 IP 0.0.0.0.bootpc > 255.255.255.255.bootps: BOOTP/DHCP, Request from 52:54:00:b3:b4:b5 (oui Unknown), length 300
12:03:16.417070 IP6 :: > ff02::16: HBH ICMP6, multicast listener report v2, 1 group record(s), length 28
12:03:16.837052 IP6 :: > ff02::1:ffb3:b4b5: ICMP6, neighbor solicitation, who has fe80::5054:ff:feb3:b4b5, length 32
12:03:17.877092 IP6 fe80::5054:ff:feb3:b4b5 > ff02::16: HBH ICMP6, multicast listener report v2, 1 group record(s), length 28
12:03:17.877099 IP6 fe80::5054:ff:feb3:b4b5 > ff02::2: ICMP6, router solicitation, length 16
12:03:18.057021 IP6 fe80::5054:ff:feb3:b4b5 > ff02::16: HBH ICMP6, multicast listener report v2, 1 group record(s), length 28
12:03:20.985051 IP 0.0.0.0.bootpc > 255.255.255.255.bootps: BOOTP/DHCP, Request from 52:54:00:b3:b4:b5 (oui Unknown), length 300
12:03:21.717021 IP6 fe80::5054:ff:feb3:b4b5 > ff02::2: ICMP6, router solicitation, length 16
12:03:26.871424 IP 0.0.0.0.bootpc > 255.255.255.255.bootps: BOOTP/DHCP, Request from 52:54:00:b3:b4:b5 (oui Unknown), length 300
12:03:29.796933 IP6 fe80::5054:ff:feb3:b4b5 > ff02::2: ICMP6, router solicitation, length 16
12:03:35.842499 IP 0.0.0.0.bootpc > 255.255.255.255.bootps: BOOTP/DHCP, Request from 52:54:00:b3:b4:b5 (oui Unknown), length 300
12:03:45.156724 IP6 fe80::5054:ff:feb3:b4b5 > ff02::2: ICMP6, router solicitation, length 16
12:03:49.234016 IP 0.0.0.0.bootpc > 255.255.255.255.bootps: BOOTP/DHCP, Request from 52:54:00:b3:b4:b5 (oui Unknown), length 300
12:04:00.986562 IP6 :: > ff02::16: HBH ICMP6, multicast listener report v2, 1 group record(s), length 28
12:04:01.037354 IP 0.0.0.0.bootpc > 255.255.255.255.bootps: BOOTP/DHCP, Request from 52:54:00:b3:b4:b5 (oui Unknown), length 300
12:04:01.406520 IP6 :: > ff02::16: HBH ICMP6, multicast listener report v2, 1 group record(s), length 28
12:04:01.436514 IP6 :: > ff02::1:ffb3:b4b5: ICMP6, neighbor solicitation, who has fe80::5054:ff:feb3:b4b5, length 32
12:04:02.516564 IP6 fe80::5054:ff:feb3:b4b5 > ff02::16: HBH ICMP6, multicast listener report v2, 1 group record(s), length 28
12:04:02.516571 IP6 fe80::5054:ff:feb3:b4b5 > ff02::2: ICMP6, router solicitation, length 16
12:04:03.476535 IP6 fe80::5054:ff:feb3:b4b5 > ff02::16: HBH ICMP6, multicast listener report v2, 1 group record(s), length 28
12:04:06.516487 IP6 fe80::5054:ff:feb3:b4b5 > ff02::2: ICMP6, router solicitation, length 16
12:04:07.712521 IP 0.0.0.0.bootpc > 255.255.255.255.bootps: BOOTP/DHCP, Request from 52:54:00:b3:b4:b5 (oui Unknown), length 300

```

**Comment by cdeadmin** [comment]
11:36:15.436391 IP 0.0.0.0.bootpc &gt; 255.255.255.255.bootps: BOOTP/DHCP, Request from 52:54:00:b3:b4:b5 (oui Unknown), length 300
11:36:22.897395 IP 0.0.0.0.bootpc &gt; 255.255.255.255.bootps: BOOTP/DHCP, Request from 52:54:00:b3:b4:b5 (oui Unknown), length 300
11:36:37.364602 IP 0.0.0.0.bootpc &gt; 255.255.255.255.bootps: BOOTP/DHCP, Request from 52:54:00:b3:b4:b5 (oui Unknown), length 300
11:36:43.681625 IP 0.0.0.0.bootpc &gt; 255.255.255.255.bootps: BOOTP/DHCP, Request from 52:54:00:b3:b4:b5 (oui Unknown), length 300
11:36:54.439354 IP 0.0.0.0.bootpc &gt; 255.255.255.255.bootps: BOOTP/DHCP, Request from 52:54:00:b3:b4:b5 (oui Unknown), length 300
11:37:14.129197 IP 0.0.0.0.bootpc &gt; 255.255.255.255.bootps: BOOTP/DHCP, Request from 52:54:00:b3:b4:b5 (oui Unknown), length 300
11:38:20.494469 IP6 :: &gt; ff02::16: HBH ICMP6, multicast listener report v2, 1 group record(s), length 28

**Comment by cdeadmin** [comment]
------- Comment From gowrishankar.m@in.ibm.com 2017-10-25 11:42:32 EDT-------
Observing virbr0, dhcp offer seem to be made while guest boots.

21:06:36.648098 52:54:00:b3:b4:b5 &gt; Broadcast, ethertype IPv4 (0x0800), length 342: 0.0.0.0.bootpc &gt; 255.255.255.255.bootps: BOOTP/DHCP, Request from 52:54:00:b3:b4:b5, length 300
21:06:39.152195 52:54:00:bf:a3:38 &gt; 52:54:00:b3:b4:b5, ethertype IPv4 (0x0800), length 342: 192.168.122.1.bootps &gt; 192.168.122.118.bootpc: BOOTP/DHCP, Reply, length 300
21:06:39.153239 52:54:00:b3:b4:b5 &gt; Broadcast, ethertype IPv4 (0x0800), length 342: 0.0.0.0.bootpc &gt; 255.255.255.255.bootps: BOOTP/DHCP, Request from 52:54:00:b3:b4:b5, length 300
21:06:45.774955 52:54:00:b3:b4:b5 &gt; Broadcast, ethertype IPv4 (0x0800), length 342: 0.0.0.0.bootpc &gt; 255.255.255.255.bootps: BOOTP/DHCP, Request from 52:54:00:b3:b4:b5, length 300
21:06:59.349663 52:54:00:b3:b4:b5 &gt; Broadcast, ethertype IPv4 (0x0800), length 342: 0.0.0.0.bootpc &gt; 255.255.255.255.bootps: BOOTP/DHCP, Request from 52:54:00:b3:b4:b5, length 300

Chasing what could have happened to this offer before reaching guest vnic..

**Comment by cdeadmin** [comment]
------- Comment From gowrishankar.m@in.ibm.com 2017-10-26 08:33:39 EDT-------
Spent sometime today to gather some more info, I see DHCP discover/offer succeeding betw guest and host, however DHCP request seem to be ignored by dnsmasq, as in dhcp dump below. I also verified the problem remain same even with dhclient supplying client-identifier in DHCP request as there was some patches related to it (and rolled back later) in dnsmasq (to implement RFC 6842 in dhcp server). So far, no other clue from packet dumps and dnsmasq logs.

Meanwhile, could you also share dnsmasq version last working for you ?. Thanks.

------- Comment (attachment only) From gowrishankar.m@in.ibm.com 2017-10-26 08:34:36 EDT-------

**Comment by cdeadmin** [comment]
------- Comment (attachment only) From gowrishankar.m@in.ibm.com 2017-10-26 23:45:01 EDT-------

**Comment by cdeadmin** [comment]
------- Comment From gowrishankar.m@in.ibm.com 2017-10-26 23:57:48 EDT-------
(In reply to comment #11)
&gt; pcap at nflog target for pre-route and input mangle

Captured packets at NF preroute and input hooks for mangle table. Interestingly, DHCP request could not make through past routing decision (i.e dhcp discover seen in input hook where as dhcp request not!), following discover/offer handshake. This throws some light now on where the problem is.

To also note, to simplify handling dhcp, I decoupled dhcp server from libvirt (remove &lt;dhcp&gt; from virbr0 network xml) and kicked off own dnsmasq instance. Verified this works in some functioning OS as well.

**Comment by cdeadmin** [comment]
------- Comment From jamesspo@us.ibm.com 2017-10-30 15:32:03 EDT-------
Moving this off to Sprint 4 as a fix target, but certainly need to keep working this as 4.14 kernel will be merged in hostos-release likely in mid November, so it would effect Sprint 4 or Sprint 5.

**Comment by cdeadmin** [comment]
------- Comment From gowrishankar.m@in.ibm.com 2017-11-04 08:19:40 EDT-------
With some probing in ip_rcv_finish(), it seems to a problem within udp_v4_early_demux() which is suppose to optimize finding dst_entry for future packets of same ntuple of ip addr/port. I don't find them in udp_rcv() if dst_entry have been correctly set on these skbs. So, it could be that ip_local_deliver not set for these skbs
correctly.

So, for now you can disable  ipv4.sysctl_ip_early_demux (=0) and proceed with your regressions - this is only to disable optimization within IP delivering packets in target transport. I verified it worked.

Host:

[root@ltc-test-ci2 ]# sysctl -w net.ipv4.ip_early_demux=0
net.ipv4.ip_early_demux = 0

tcpdump:
15:44:38.764989 52:54:00:b3:b4:b5 &gt; Broadcast, ethertype IPv4 (0x0800), length 342: (tos 0x10, ttl 128, id 0, offset 0, flags [none], proto UDP (17), length 328)
    0.0.0.0.bootpc &gt; 255.255.255.255.bootps: [udp sum ok] BOOTP/DHCP, Request from 52:54:00:b3:b4:b5, length 300, xid 0xd33eee3b, Flags [none] (0x0000)
	  Client-Ethernet-Address 52:54:00:b3:b4:b5
	  Vendor-rfc1048 Extensions
	    Magic Cookie 0x63825363
	    DHCP-Message Option 53, length 1: Request
	    Requested-IP Option 50, length 4: 192.168.122.100
	    Parameter-Request Option 55, length 18: 
	      Subnet-Mask, BR, Time-Zone, Classless-Static-Route
	      Domain-Name, Domain-Name-Server, Hostname, YD
	      YS, NTP, MTU, Option 119
	      Default-Gateway, Classless-Static-Route, Classless-Static-Route-Microsoft, Static-Route
	      Option 252, NTP
	    END Option 255, length 0
	    PAD Option 0, length 0, occurs 30
15:44:38.766569 52:54:00:bf:a3:38 &gt; 52:54:00:b3:b4:b5, ethertype IPv4 (0x0800), length 342: (tos 0xc0, ttl 64, id 32006, offset 0, flags [none], proto UDP (17), length 328)
    192.168.122.1.bootps &gt; 192.168.122.100.bootpc: [udp sum ok] BOOTP/DHCP, Reply, length 300, xid 0xd33eee3b, Flags [none] (0x0000)
	  Your-IP 192.168.122.100
	  Server-IP 192.168.122.1
	  Client-Ethernet-Address 52:54:00:b3:b4:b5
	  Vendor-rfc1048 Extensions
	    Magic Cookie 0x63825363
	    DHCP-Message Option 53, length 1: ACK
	    Server-ID Option 54, length 4: 192.168.122.1
	    Lease-Time Option 51, length 4: 3600
	    RN Option 58, length 4: 1800
	    RB Option 59, length 4: 3150
	    Subnet-Mask Option 1, length 4: 255.255.255.0
	    BR Option 28, length 4: 192.168.122.255
	    Default-Gateway Option 3, length 4: 192.168.122.1
	    Domain-Name-Server Option 6, length 4: 192.168.122.1
	    Hostname Option 12, length 3: &quot;vm1&quot;
	    END Option 255, length 0
	    PAD Option 0, length 0, occurs 3

Guest:

[root@localhost ~]# ifup eth0
Connection successfully activated (D-Bus active path: /org/freedesktop/NetworkManager/ActiveConnection/32)
[root@localhost ~]# ip r s
default via 192.168.122.1 dev eth0 proto static metric 100 
192.168.122.0/24 dev eth0 proto kernel scope link src 192.168.122.100 metric 100 

Now, I need to figure out whether skb reached ip_local_deliver after early demux and if so, where it drops before heading to udp.

**Comment by sathnaga** [comment]
With the latest devel kernel update, 4.14.0-2.rc8.dev.gitcc4bf22.el7.centos.ppc64le, I am not able see this issue.
Guest is able to get dhcp ip.

Closing as fix already available.
